{
  "action": "accept",
  "actor": {
    "actor_id": "prn_00000001-0000-4000-8000-000000000001",
    "actor_type": "owner"
  },
  "approval_nonce": "nonce-synthetic-0002-abcdefghij",
  "approved_diff_hash": "fd22cd952c375659ee285e61d2bcfba89fbb0c0a9933414addf0d75c354b1b6f",
  "candidate_id": "cand_00000002-0000-4000-8000-000000000002",
  "candidate_revision": 1,
  "commit_id": "cmt_00000004-0000-4000-8000-000000000004",
  "created_at": "2026-07-02T13:00:00.000Z",
  "effective_from": null,
  "evidence_refs": [
    {
      "source_id": "src_00000002-0000-4000-8000-000000000002",
      "source_revision": 1
    }
  ],
  "final_content_hash": "544f3cdaa9507349ee4260ea4d1ed6e36aadf642ad1e94cf64b3e8c7786c7aae",
  "merge_target": null,
  "reason_code": null,
  "resulting_records": [
    {
      "record_id": "mem_00000002-0000-4000-8000-000000000002",
      "record_kind": "memory",
      "revision": 1
    },
    {
      "record_id": "prj_00000001-0000-4000-8000-000000000001",
      "record_kind": "project",
      "revision": 1
    }
  ],
  "review_id": "rvw_00000002-0000-4000-8000-000000000002",
  "schema_version": 1,
  "target_expected_revisions": [],
  "trusted_surface": "trusted_windows_app"
}
